{
  "$schema": "./test-config.schema.json",
  "version": 1,
  "description": "Generic SharePoint research configuration. Enter authorized tenant and resource details here before testing; credentials do not belong here.",
  "environment": {
    "name": "local-dev",
    "tenantUrl": "https://pmsobb.sharepoint.com",
    "tenantId": "",
    "siteUrl": "https://pmsobb.sharepoint.com/sites/Research",
    "siteCollectionId": "",
    "siteId": "",
    "webId": "",
    "webUrl": "/",
    "personalDocumentsUrl": ""
  },
  "resources": {
    "lists": {
      "primary": {
        "id": "",
        "title": "",
        "template": 100,
        "baseType": 0,
        "itemEntityType": "",
        "serverRelativeUrl": ""
      },
      "documents": {
        "id": "",
        "title": "Documents",
        "template": 101,
        "baseType": 1,
        "serverRelativeUrl": "/Shared Documents"
      },
      "sitePages": {
        "id": "",
        "title": "Site Pages",
        "template": 119,
        "baseType": 1,
        "serverRelativeUrl": "/SitePages"
      },
      "siteAssets": {
        "id": "",
        "title": "Site Assets",
        "template": 101,
        "baseType": 1,
        "serverRelativeUrl": "/SiteAssets"
      },
      "userInformationList": {
        "id": "",
        "title": "User Information List",
        "template": 100,
        "baseType": 0,
        "serverRelativeUrl": "/Lists/User Information List"
      },
      "lookup": {
        "id": "",
        "title": "",
        "template": 100,
        "baseType": 0,
        "serverRelativeUrl": ""
      }
    },
    "items": {
      "primaryItemId": 2,
      "secondaryItemId": 3,
      "nonExistentItemId": 2147483000,
      "boundaryItemIds": [
        0,
        -1,
        -2147483648,
        2147483647
      ],
      "stringIds": [
        "",
        " ",
        "abc",
        "1'",
        "1 or 1=1",
        "1.0",
        "0x10",
        "1;2"
      ],
      "primaryItemUniqueId": ""
    },
    "folders": {
      "primaryFolderId": 27,
      "testFolderName": "TestFolder",
      "createdFolderName": "TejTest",
      "serverRelativePath": "",
      "documentLibraryFolder": "/Shared Documents"
    },
    "files": {
      "testFileName": "Attackerfile.txt",
      "testFileContent": "controlled probe",
      "uploadId": "",
      "nonexistentFileName": "does-not-exist-9f2c1a.txt",
      "serverRelativePath": "/Shared Documents/Attackerfile.txt"
    },
    "fields": {
      "titleFieldName": "Title",
      "textFieldName": "Title",
      "choiceFieldName": "Choice",
      "lookupFieldName": "Lookup",
      "nonexistentFieldName": "NoSuchField9f2c1a",
      "titleFieldId": "",
      "relatedFieldGroupId": "",
      "testChoiceValue": "ResearchChoice"
    },
    "contentTypes": {
      "itemContentTypeId": "0x0100",
      "documentContentTypeId": "0x0101",
      "customContentTypeId": "",
      "nonexistentContentTypeId": "0x0100FFFFFFFFFFFFFFFFFFFFFFFFFFFFFFFF"
    },
    "views": {
      "viewId": "",
      "viewName": "",
      "nonexistentViewId": "00000000-0000-0000-0000-000000000000",
      "viewXml": "<View><Query></Query><ViewFields><FieldRef Name=\"ID\"/><FieldRef Name=\"Title\"/></ViewFields><RowLimit Paged=\"TRUE\">10</RowLimit></View>"
    },
    "attachments": {
      "fileName": "attachment-probe.txt",
      "contentType": "text/plain",
      "content": "controlled probe"
    },
    "webs": {
      "testTitle": "",
      "testSiteUrl": "",
      "testUrlSegment": "",
      "description": "",
      "template": "STS",
      "siteTemplate": "SITEPAGEPUBLISHING#0",
      "language": 1033,
      "siteAlias": "",
      "siteDisplayName": ""
    },
    "pages": {
      "homePage": "SitePages/Home.aspx",
      "testPage": "SitePages/test.aspx"
    }
  },
  "principals": {
    "users": {
      "primary": {
        "upn": "",
        "loginName": "",
        "id": 0
      },
      "secondary": {
        "upn": "",
        "loginName": "",
        "id": 0
      }
    },
    "groups": {
      "primaryGroupId": 0,
      "primaryGroupName": "",
      "ownerGroupId": 0,
      "memberGroupId": 0,
      "visitorGroupId": 0,
      "shareWith": [],
      "groupsToEnumerate": []
    },
    "roleDefinitions": {
      "read": 1073741826,
      "contribute": 1073741827,
      "edit": 1073741830,
      "design": 1073741828,
      "fullControl": 1073741829,
      "restrictedRead": 1073741825,
      "all": [
        1073741829,
        1073741828,
        1073741830,
        1073741827,
        1073741826,
        1073741832,
        1073741825,
        1073741833
      ]
    },
    "principalIds": [],
    "shareLinkKinds": [
      0,
      1,
      2,
      3,
      4,
      5,
      6
    ],
    "shareLinkRoleKinds": [
      5,
      6,
      7,
      8,
      27,
      32,
      28,
      30,
      29,
      3,
      0,
      1,
      2,
      4,
      3
    ],
    "scope": [
      0,
      1,
      2,
      3
    ],
    "permissionKinds": [
      1,
      2,
      3,
      4,
      5,
      6
    ]
  },
  "taxonomy": {
    "termStoreId": "",
    "termGroupId": "",
    "termSetId": "",
    "termId": "",
    "note": "Leave blank until a term store is configured for the test site. Taxonomy endpoints are Unsupported until then."
  },
  "search": {
    "queryText": "contentclass:STS_ListItem",
    "rowLimit": 10,
    "resultSourceId": "",
    "sortList": [
      "[docid]",
      "desc"
    ]
  },
  "testData": {
    "item": {
      "valid": {
        "Title": "Controlled probe"
      },
      "withUnexpectedFields": {
        "Title": "Controlled probe",
        "UnexpectedProperty9f2c1a": "value"
      },
      "withProtectedFields": {
        "Title": "Controlled probe",
        "Id": 1,
        "AuthorId": 1,
        "Created": "{{timestamp:-365d}}",
        "Modified": "{{timestamp:0m}}"
      },
      "nullValues": {
        "Title": null
      },
      "emptyValues": {
        "Title": ""
      },
      "wrongTypes": {
        "Title": 12345
      },
      "unicode": {
        "Title": "Prueba-üñîçødé-你好-😀"
      },
      "xss": {
        "Title": "<img src=x onerror=alert(1)>"
      },
      "odataInjection": {
        "Title": "x' or Title ne 'y"
      },
      "largeValue": {
        "Title": "AAAAAAAAAAAAAAAAAAAAAAAAAAAAAAAAAAAAAAAAAAAAAAAAAAAAAAAAAAAAAAAAAAAAAAAAAAAAAAAAAAAAAAAAAAAAAAAAAAAAAAAAAAAAAAAAAAAAAAAAAAAAAAAAAAAAAAAAAAAAAAAAAAAAAAAAAAAAAAAAAAAAAAAAAAAAAAAAAAAAAAAAAAAAAAAAAAAAAAAAAAAAAAAAAAAAAAAAAAAAAAAAAAAAAAAAAAAAAAAAAAAAAAAAAAAAAAAAAAAAAAAAAAAAAAAAAAAAAAAAAAAAAAAAAAAAAAAAAAAAAAAAAAAAAAAAAAAAAAAAAAAAAAAAAAAAAAAAAAAAAAAAAAAAAAAAAAAAAAAAAAAAAAAAAAAAAAAAAAAAAAAAAAAAAAAAAAAAAAAAAAAAAAAAAAAAAAAAAAAAAAAAAAAA"
      }
    },
    "malformedJsonBodies": [
      "{",
      "{\"Title\":}",
      "{\"Title\":\"unterminated}",
      "[]",
      "null",
      "\"string\"",
      "12345",
      ""
    ],
    "headers": {
      "contentTypes": [
        "application/json",
        "application/json;odata=verbose",
        "application/json;odata=minimalmetadata",
        "application/json;odata=nometadata",
        "text/plain",
        "application/xml",
        "multipart/form-data; boundary=----probe"
      ],
      "accepts": [
        "application/json",
        "application/json;odata=verbose",
        "application/json;odata=nometadata",
        "application/xml",
        "text/html",
        "*/*"
      ]
    },
    "constants": {
      "note": "Legacy display/test values used by src/webparts/hacktheworld/components/constants.ts. Identifiers (list/item/user ids, tenant URL, content type id) are read from the structured sections above; these entries are only literals that have no structured home yet.",
      "users": {
        "primaryName": "TMSOBB",
        "primaryLastName": "Testt",
        "primaryWorkPhone": "9075197067",
        "primaryPictureUrl": "",
        "primaryPictureTimestamp": "{{timestamp:0m}}"
      },
      "entityIds": {
        "objectId": "",
        "userGuid": "",
        "viewId": "",
        "templateFeatureId": "00bfea71-de22-43b2-a848-c05709900100",
        "defaultWorkflowId": "00000000-0000-0000-0000-000000000000",
        "emptyGuid": "00000000-0000-0000-0000-000000000000",
        "approvalId": "",
        "commentId": "",
        "recycleBinItemId": ""
      },
      "sharepoint": {
        "siteTitle": "Communication site",
        "siteTemplate": "SITEPAGEPUBLISHING",
        "welcomePage": "SitePages/Home.aspx",
        "testWelcomePage": "SitePages/test.aspx",
        "masterUrl": "/_catalogs/masterpage/seattle.master",
        "imageUrl": "/_layouts/15/images/itgen.png?rev=47",
        "language": 1033,
        "uiVersion": 15
      },
      "email": {
        "sharingSubject": "SharePoint user is inviting you to collaborate",
        "sharingSubject2": "Item shared2",
        "sharingBody": "hhh",
        "sharingInvitationSubject": "Sharing Invitation",
        "sharingInvitationBody": "You have been granted access to the resource.",
        "testSubject": "Test Subject",
        "testBody": "Test Body"
      },
      "comments": {
        "anonymousComment": "Written comment anonymously even if it is disabled",
        "mentionComment": "Hii @mention{0} ",
        "attackerComment": "Attacker addeddd",
        "aaaaComment": "aaaa"
      },
      "dates": {
        "futureExpiration": "{{timestamp:+30d}}",
        "pastExpiration": "{{timestamp:-1d}}",
        "createdDate": "{{timestamp:-365d}}",
        "modifiedDate": "{{timestamp:0m}}",
        "lastModified": "{{timestamp:-5m}}",
        "lastUserModified": "{{timestamp:-10m}}"
      },
      "changeTokens": {
        "listToken": "",
        "siteToken": "",
        "updatedSiteToken": ""
      },
      "listProperties": {
        "title": "Test",
        "description": "",
        "direction": "none",
        "draftVersionVisibility": 0,
        "majorVersionLimit": 50,
        "minorVersionLimit": 10,
        "enableVersioning": true,